id,site,job_url,job_url_direct,title,company,location,date_posted,job_type,salary_source,interval,min_amount,max_amount,currency,is_remote,job_level,job_function,listing_type,emails,description,company_industry,company_url,company_logo,company_url_direct,company_addresses,company_num_employees,company_revenue,company_description
in-ff3d7c6f0fd79120,indeed,https://www.indeed.com/viewjob?jk=ff3d7c6f0fd79120,https://grnh.se/c18ojjvv1us,"Software Engineer, Unsecured Installments",Upstart,"Remote, US",2026-07-09,[],,,,,,True,,,,_accommodations@upstart.com,"**About Upstart**

At Upstart, we're united by a mission that matters: to radically reduce the cost and complexity of borrowing for all Americans. Every day, we bring creativity, experimentation, and advanced AI to reshape access to credit, helping millions move forward financially with clarity and confidence.

As the leading AI lending marketplace, we partner with banks and credit unions to expand access to affordable credit through technology that's both radically intelligent and deeply human. Our platform runs over one million predictions per borrower using more than 1,800 signals, powering smarter, fairer decisions for millions of customers. But the numbers only hint at the impact. Every idea, every voice, and every contribution moves us closer to a world where credit never stands between people and their financial progress.

We're proudly digital-first, giving most Upstarters the flexibility to do their best work from wherever they thrive, alongside teammates across 80+ cities in the US and Canada. Digital-first doesn't mean distant. We're intentional about in-person connection through team onsites, planning sessions, and moments that spark creativity and trust. And whether you choose to work primarily from home or collaborate in-person from one of our offices in Columbus, Austin, the Bay Area, or New York City (opening Summer 2026), you'll have the support to work in the way that works best for you.

If you're energized by tackling meaningful problems, excited to innovate with purpose, and motivated by work that truly matters, we'd love to hear from you.

**The Team:**

Unsecured Installments is one of Upstart's core lending products, helping borrowers access credit through a seamless, digitally native experience. The team owns critical parts of the borrower journey across offer generation, pricing, underwriting, funding, and borrower experience, while working closely with the broader lending platform that powers Upstart at scale. Recent work has focused on improving borrower flows, repricing and rate flexibility, partnership experiences, and the overall quality of the customer-facing experience.

As a Software Engineer on the Unsecured Installments team, you'll build and improve the frontend and full-stack experiences that borrowers interact with directly. You'll work primarily in React and TypeScript to ship polished, reliable, high-performing borrower flows, while partnering with backend, product, and design to connect those experiences to the systems behind pricing, underwriting, and funding. This is a hands-on role where you'll own meaningful features end to end and grow your technical depth on a business-critical product.

  

**How you'll make an impact**

* Build and maintain borrower-facing web experiences using React and TypeScript, translating designs and product requirements into clean, responsive, accessible interfaces.
* Work across the stack to connect frontend experiences to backend services and APIs, contributing to full-stack features that span the borrower journey.
* Partner closely with product managers, designers, and backend engineers to scope, build, and ship features that improve borrower flows and reduce friction.
* Write well-tested, maintainable code and participate in code reviews, helping raise the quality and consistency of the team's frontend codebase.
* Contribute to performance, reliability, and observability of the experiences you own, and help debug and resolve issues across environments.
* Support experimentation and iterative improvements to borrower flows, using data and feedback to inform what gets built next.

  

**Minimum Qualifications**

* Bachelor's degree in Computer Science, Engineering, or a related field (or equivalent practical experience) and 4-5+ years of professional software engineering experience.
* Strong proficiency building web applications with React and TypeScript, including component design, state management, and consuming REST or GraphQL APIs.
* Full-stack experience contributing to backend services and APIs in a language such as Python, Java, Kotlin, Ruby, or Node.js.
* Solid fundamentals in writing tested, maintainable code and collaborating through code review in a team environment.
* Ability to work effectively with product and design partners to deliver features from requirements through production.

  

**Preferred Qualifications**

* Experience building consumer-facing products with attention to performance, accessibility, and user experience.
* Familiarity with modern frontend tooling and testing frameworks (e.g., Jest, React Testing Library, Cypress) and CI/CD workflows.
* Exposure to fintech, lending, payments, or other regulated financial products with complex user journeys.
* Experience with experimentation, A/B testing, or feature-flagging in production environments.
* Active use of AI tools in engineering workflows, with a thoughtful perspective on how AI is reshaping software development.
* Passion for building products that expand access to credit and improve financial outcomes for consumers.

  

**Position location** This role is available in the following locations: Remote

**Travel requirements** As a digital first company, the majority of your work can be accomplished remotely. The majority of our employees can live and work anywhere in the U.S but are encouraged to to still spend high quality time in-person collaborating via regular onsites. The in-person sessions' cadence varies depending on the team and role; most teams meet once or twice per quarter for 2-4 consecutive days at a time.

  

#LI-REMOTE

#LI-Associate -> use for L3, L4

**What you'll love**

At Upstart, our benefits are designed to support your health, financial well-being, family, and personal growth. Here's what you can expect:

* Competitive compensation, including base pay, bonus opportunities, and annual equity grants that vest quarterly
* Retirement benefits to help you plan for the future, including a 401(k) or Group Retirement Savings Plan with a company match of $2 for every $1 contributed, up to $15,000 annually (USD in the US, CAD in Canada)
* Employee Stock Purchase Plan (ESPP) with discounted stock purchase options for eligible employees (US only)
* Comprehensive health coverage designed to support you and your family, including medical, dental, vision, and wellness resources for US and supplemental health coverage for Canada.
* Health Savings Account contributions from Upstart for eligible plans (US only)
* Income protection benefits, including life insurance and disability coverage for added financial security
* Paid time off, sick leave, and company holidays, in line with local requirements
* Paid family and parental leave to support caregiving and major life moments (duration varies by country)
* Family-centered benefits to support fertility, parenthood, and caregiving needs
* Employee Assistance Program (EAP) offering mental health support and life-centered resources
* Financial wellness resources, including access to financial planning tools and a financial concierge service (US Only)
* Annual wellness allowance to support your physical and emotional well-being and personal development, based on what matters most to you
* Annual productivity allowance to invest in relevant tools and resources you need to do your best work, no matter where you work from
* Connection and community through team events, all-company updates, and employee resource groups (ERGs)
* Onsite perks, including catered lunches and fully stocked micro-kitchens when working from one of our offices in the Bay Area, Austin, Columbus, and New York City (opening Summer 2026!)

For roles based in Canada, please note that we are not currently able to hire in Quebec.

Upstart is a proud Equal Opportunity Employer. Just as we are dedicated to improving access to affordable credit for all, we are committed to inclusive and fair hiring practices.

*If you require reasonable accommodation in completing an application, interviewing, completing any pre-employment testing, or otherwise participating in the employee selection process, please email candidate\_accommodations@upstart.com*

https://www.upstart.com/candidate\_privacy\_policy",,https://www.indeed.com/cmp/Upstart,,, ,,,
in-6f4b3078f40d422a,indeed,https://www.indeed.com/viewjob?jk=6f4b3078f40d422a,https://grnh.se/2ykgn0bc1us,"Senior Software Engineer, Unsecured Installments",Upstart,"Remote, US",2026-07-09,[],,,,,,True,,,,_accommodations@upstart.com,"**About Upstart**

At Upstart, we're united by a mission that matters: to radically reduce the cost and complexity of borrowing for all Americans. Every day, we bring creativity, experimentation, and advanced AI to reshape access to credit, helping millions move forward financially with clarity and confidence.

As the leading AI lending marketplace, we partner with banks and credit unions to expand access to affordable credit through technology that's both radically intelligent and deeply human. Our platform runs over one million predictions per borrower using more than 1,800 signals, powering smarter, fairer decisions for millions of customers. But the numbers only hint at the impact. Every idea, every voice, and every contribution moves us closer to a world where credit never stands between people and their financial progress.

We're proudly digital-first, giving most Upstarters the flexibility to do their best work from wherever they thrive, alongside teammates across 80+ cities in the US and Canada. Digital-first doesn't mean distant. We're intentional about in-person connection through team onsites, planning sessions, and moments that spark creativity and trust. And whether you choose to work primarily from home or collaborate in-person from one of our offices in Columbus, Austin, the Bay Area, or New York City (opening Summer 2026), you'll have the support to work in the way that works best for you.

If you're energized by tackling meaningful problems, excited to innovate with purpose, and motivated by work that truly matters, we'd love to hear from you.

**The Team:**

Unsecured Installments is one of Upstart's core lending products, helping borrowers access credit through a seamless, digitally native experience. The team owns critical parts of the borrower journey across offer generation, pricing, underwriting, funding, and borrower experience, while working closely with the broader lending platform that powers Upstart at scale. Recent work has focused on improving borrower flows, repricing and rate flexibility, partnership experiences, and the overall quality of the customer-facing experience.

As a Senior Software Engineer on the Unsecured Installments team, you'll be a technical leader for the frontend and full-stack experiences that borrowers interact with directly. Working primarily in React and TypeScript, you'll own the delivery of large, multi-month projects, shape the architecture of the team's mobile-web and full-stack surfaces, and set a high bar for quality across the borrower experience. You'll partner closely with product, design, and backend engineers to turn ambiguous problems into durable, well-architected solutions, and you'll mentor other engineers along the way.

  

**How you'll make an impact**

* Own the design and delivery of large, complex frontend and full-stack initiatives using React and TypeScript, from planning and sequencing through launch and long-term maintenance.
* Set technical direction for the team's frontend architecture and full-stack patterns, owning a 3–6 month roadmap and proactively addressing systemic gaps that threaten team effectiveness.
* Partner closely with product, design, and backend engineers to translate roadmap priorities and borrower needs into scalable, high-quality experiences.
* Raise the bar for engineering excellence through strong component and API design, thoughtful state management, testing, observability, and operational rigor across borrower-facing surfaces.
* Lead through ambiguity, breaking down loosely defined problems into clear, testable plans and using data to inform tradeoffs on scope, performance, and user experience.
* Mentor and grow other engineers through code reviews, design reviews, and technical guidance, and serve as a trusted collaborator across the team.
* Contribute to how the team uses AI in development workflows and product capabilities, with a pragmatic view of where it can create meaningful leverage.

  

**Minimum Qualifications**

* Bachelor's degree in Computer Science, Engineering, or a related field (or equivalent practical experience) and 6+ years of professional software engineering experience.
* Deep proficiency building complex web applications with React and TypeScript, including component architecture, state management, performance optimization, and consuming REST or GraphQL APIs.
* Full-stack experience designing and building backend services and APIs in a language such as Python, Java, Kotlin, Ruby, or Node.js.
* Track record of independently leading the design and delivery of large, business-critical frontend or full-stack projects in production.
* Ability to work effectively in ambiguous environments where product requirements, constraints, and system boundaries evolve over time.
* Strong communication and collaboration skills, with the ability to explain technical tradeoffs and align product, design, and engineering partners.

  

**Preferred Qualifications**

* Experience serving as the frontend or full-stack technical lead for a product team or business-critical product surface.
* Experience building consumer-facing products at scale with strong attention to performance, accessibility, and user experience.
* Background in fintech, lending, payments, or other regulated financial products with complex user journeys and high quality expectations.
* Experience with experimentation, A/B testing, or feature-flagging to drive iterative product improvements in production.
* Familiarity with modern frontend tooling and testing frameworks (e.g., Jest, React Testing Library, Cypress) and CI/CD workflows.
* Hands-on experience leveraging generative AI in product features or internal engineering workflows.
* Passion for building products that expand access to credit and improve financial outcomes for consumers.

  

**Position location** This role is available in the following locations: Remote

**Travel requirements** As a digital first company, the majority of your work can be accomplished remotely. The majority of our employees can live and work anywhere in the U.S but are encouraged to to still spend high quality time in-person collaborating via regular onsites. The in-person sessions' cadence varies depending on the team and role; most teams meet once or twice per quarter for 2-4 consecutive days at a time.

  

#LI-REMOTE

#LI-MidSenior -> use for L5, L6

**What you'll love**

At Upstart, our benefits are designed to support your health, financial well-being, family, and personal growth. Here's what you can expect:

* Competitive compensation, including base pay, bonus opportunities, and annual equity grants that vest quarterly
* Retirement benefits to help you plan for the future, including a 401(k) or Group Retirement Savings Plan with a company match of $2 for every $1 contributed, up to $15,000 annually (USD in the US, CAD in Canada)
* Employee Stock Purchase Plan (ESPP) with discounted stock purchase options for eligible employees (US only)
* Comprehensive health coverage designed to support you and your family, including medical, dental, vision, and wellness resources for US and supplemental health coverage for Canada.
* Health Savings Account contributions from Upstart for eligible plans (US only)
* Income protection benefits, including life insurance and disability coverage for added financial security
* Paid time off, sick leave, and company holidays, in line with local requirements
* Paid family and parental leave to support caregiving and major life moments (duration varies by country)
* Family-centered benefits to support fertility, parenthood, and caregiving needs
* Employee Assistance Program (EAP) offering mental health support and life-centered resources
* Financial wellness resources, including access to financial planning tools and a financial concierge service (US Only)
* Annual wellness allowance to support your physical and emotional well-being and personal development, based on what matters most to you
* Annual productivity allowance to invest in relevant tools and resources you need to do your best work, no matter where you work from
* Connection and community through team events, all-company updates, and employee resource groups (ERGs)
* Onsite perks, including catered lunches and fully stocked micro-kitchens when working from one of our offices in the Bay Area, Austin, Columbus, and New York City (opening Summer 2026!)

For roles based in Canada, please note that we are not currently able to hire in Quebec.

Upstart is a proud Equal Opportunity Employer. Just as we are dedicated to improving access to affordable credit for all, we are committed to inclusive and fair hiring practices.

*If you require reasonable accommodation in completing an application, interviewing, completing any pre-employment testing, or otherwise participating in the employee selection process, please email candidate\_accommodations@upstart.com*

https://www.upstart.com/candidate\_privacy\_policy",,https://www.indeed.com/cmp/Upstart,,, ,,,
in-fd1d7eb703d4f1a6,indeed,https://www.indeed.com/viewjob?jk=fd1d7eb703d4f1a6,http://www.indeed.com/job/full-stack-developer-fd1d7eb703d4f1a6,Full Stack Developer,"First Vulcan, Inc","Remote, US",2026-07-09,[],description,CompensationInterval.HOURLY,25.0,50.0,USD,True,,,,[],"We are seeking a seasoned **Senior Full Stack Engineer** to join us on a contract basis. This is a role for an engineer who finds satisfaction in the ""art of the polish""—refining existing systems, strengthening security, and shipping reliable features within a live production environment.

**The Focus:** Stability, refinement, and disciplined execution. **The Reality:** This is not a ""rebuild everything"" or greenfield project. We need someone who respects established architecture and focuses on incremental, high-impact improvements.

Our Current Tech Stack

We operate on a modern, streamlined stack. Proficiency in these specific tools is essential:

* **Frontend:** React, Next.js (App Router)
* **Backend:** Node.js, TypeScript
* **Database:** PostgreSQL (via Supabase)
* **Infrastructure:** Vercel

Key Responsibilities

* **Hardening Logic:** Strengthen backend processes, edge-case handling, and permission structures.
* **Feature Delivery:** Implement new features accurately based on defined technical specifications.
* **Performance Tuning:** Identify and resolve bottlenecks to improve overall system reliability.
* **Pragmatic Refactoring:** Clean and optimize code incrementally without disrupting current workflows or over-engineering solutions.
* **Execution:** Take ownership of the ""middle-to-end"" of the development lifecycle with minimal oversight.

Requirements

* **Experience:** 6–10+ years of professional production experience.
* **System Stewardship:** A proven track record of maintaining and enhancing existing, complex systems rather than just building new ones.
* **Security Mindset:** Deep understanding of authentication, authorization, and data integrity.
* **Autonomy:** Highly self-directed; you thrive when given a goal and the trust to execute it.
* **Verification:** Identity and professional references will be strictly verified.

This Role is NOT a Fit if:

* You are looking for a Co-founder or CTO position.
* Your first instinct is to propose a total system redesign or ""tear it all down.""
* You are early in your career and require active mentorship or hand-holding.
* You prefer theoretical architecture over hands-on, disciplined shipping.

How to Apply

We value pragmatism, accountability, and steady progress. If that resonates with you, please provide:

* **Resume**
* **GitHub Link** (if available)
* **Two Brief Descriptions** of recent production challenges you solved within an existing codebase.

Pay: $25.00 - $50.00 per hour

Work Location: Remote",,"https://www.indeed.com/cmp/First-Vulcan,-Inc-2",,http://firstvulcan.com/,,,,
in-d2d60dea3646cd19,indeed,https://www.indeed.com/viewjob?jk=d2d60dea3646cd19,https://jobs.lever.co/lemnis/99ad0e0e-1f41-410d-bc52-2a1f4a63a077?lever-source=Indeed,Full Stack Software Engineer,LEMNIS,"Remote, US",2026-07-08,[],description,CompensationInterval.YEARLY,120000.0,140000.0,USD,True,,,,[],"**Full Stack Software Engineer**

Full-Time (Primarily Remote)

**Division:** **Mainstay**

**Salary**: **$120,000 - $140,000**

### ***Join our team at Mainstay - a division of Lemnis! Lemnis is a public charity dedicated to harnessing transformative change to expand learning for all. We are excited to announce a new opportunity for a*** ***Full Stack Software Engineer*** ***at Mainstay. We are committed to fostering a collaborative and inclusive work environment where every team member can thrive. If you are passionate about expanding learning for all, eager to make a meaningful impact, and ready to take on new challenges, we would love to hear from you. Apply now and be a part of our journey!***

### **Position Summary**

At Mainstay, we believe one conversation can spark a brighter future. Our Engagement Platform makes it easy for colleges and businesses to start and measure conversations that drive action at scale. From our rigorous research methods to our Behavioral Intelligence framework — everything we do is designed to help people take the next step toward achieving their goals.

The engineering team is a group of talented full stack developers, data engineers, data analysts, and AI experts. Engineers collaborate closely with their counterparts in the product team and external stakeholders to build new functionality and enhance existing products to delight our partners and end users. The team is excited to continue tackling new challenges and leverage cutting edge technologies to solve impactful problems.

### **Responsibilities:**

* Strong proficiency across the stack, with production experience in a modern frontend framework (React preferred) and a backend language (Python/Django or Node/TypeScript)
* Solid grasp of computer science fundamentals: data structures, algorithms, and system design
* Experience writing automated tests and maintaining meaningful test coverage
* Familiarity with software engineering best practices (git, CI/CD, code review, PRs)
* Experience building and consuming APIs (REST or GraphQL)
* Comfortable working with relational databases and writing efficient queries
* Strong communication skills with an ability to collaborate cross-functionally
* Flexibility, ownership, and a team player mentality

**Ship full stack features end to end**

* Rapidly prototype, develop, and ship server-side and user-facing code every single day
* Work across a full stack codebase including a React frontend (TypeScript) and Python (Django) and Node (TypeScript) backend
* Own features from product discovery through implementation, testing, and release

**Write high-quality, maintainable code**

* Write clean, well-tested code and the corresponding automated tests
* Review peers' code and uphold engineering standards across the team
* Refactor and improve existing systems as the product evolves

**Keep what you ship stable**

* You ensure code is reliable and stable once deployed
* Monitor, debug, and resolve issues in production
* Contribute to CI/CD pipelines and deployment practices
* Collaborate across the team working with Engineering, Product, and Design through product discovery, implementation, and testing
* Translate product requirements into technical solutions
* Share knowledge and mentor through pairing and code review

**Qualifications**

* 5+ years of experience as a software engineer in an Agile environment

**Preferred Qualifications**

* You augment your capacity with AI or LLM-powered product and features
* Use agentic coding tools (Claude Code, Cursor, Copilot, Codex, or similar) as a daily part of your workflow to plan, write, test, and refactor faster
* Apply strong judgment to AI-generated code: you own correctness, security, and architecture, and you can spot when an agent is wrong or hallucinating
* EdTech, higher education, or B2B SaaS background
* Experience working on partner-facing or customer-facing products
* Comfort with ambiguity and a bias toward shipping

We may use artificial intelligence (AI) tools to support parts of the hiring process, such as reviewing applications, analyzing resumes, or assessing responses and identifying potential inconsistencies or verification signals in application materials based on available information. These tools assist our recruitment team but do not replace human judgment. Final hiring decisions are ultimately made by humans. If you would like more information about how your data is processed, please contact us.",,https://www.indeed.com/cmp/Lemnis,,,,,,
